#term ID	term description	observed gene count	background gene count	strength	false discovery rate	matching proteins in your network (IDs)	matching proteins in your network (labels)
CL:16433	Collagen biosynthesis and modifying enzymes	6	57	2.27	1.80e-09	9606.ENSP00000263556,9606.ENSP00000331902,9606.ENSP00000354960,9606.ENSP00000369889,9606.ENSP00000384999,9606.ENSP00000401749	P4HA1,COL4A5,COLGALT2,COL2A1,P4HA2,P4HA3
CL:16434	Collagen biosynthesis and modifying enzymes	5	38	2.37	2.79e-08	9606.ENSP00000263556,9606.ENSP00000331902,9606.ENSP00000354960,9606.ENSP00000384999,9606.ENSP00000401749	P4HA1,COL4A5,COLGALT2,P4HA2,P4HA3
CL:16437	Collagen biosynthesis and modifying enzymes	4	22	2.51	5.20e-07	9606.ENSP00000263556,9606.ENSP00000354960,9606.ENSP00000384999,9606.ENSP00000401749	P4HA1,COLGALT2,P4HA2,P4HA3
CL:16438	FACIT collagen trimer, and procollagen-proline dioxygenase activity	3	13	2.61	3.72e-05	9606.ENSP00000263556,9606.ENSP00000384999,9606.ENSP00000401749	P4HA1,P4HA2,P4HA3
CL:30372	Chandler syndrome, and Zinc finger protein 469	2	5	2.85	0.0027	9606.ENSP00000369399,9606.ENSP00000380901	SLC4A11,COL8A2
